tata_company,tata_rows,normalized_name,inferred_parent,recommended_parent,in_spring_canonical,in_spring_aliases,in_spring_entity_members,in_base_only,fix_bucket,priority,recommended_action
平安车管家服务有限公司,4,平安车管家服务有限公司,平安车管家服务有限公司,,False,False,False,False,high_risk_manual_review,p1,manual_review
广东快客电子商务有限公司,4,广东快客电子商务有限公司,广东快客电子商务有限公司,,False,False,False,False,high_risk_manual_review,p1,manual_review
广东省环保集团有限公司,4,广东省环保集团有限公司,广东省环保集团有限公司,,False,False,False,False,high_risk_manual_review,p1,manual_review
广东粤海水务股份有限公司,4,广东粤海水务股份有限公司,广东粤海水务股份有限公司,,False,False,False,False,high_risk_manual_review,p1,manual_review
广东领益智造股份有限公司,4,广东领益智造股份有限公司,广东领益智造股份有限公司,,False,False,False,False,high_risk_manual_review,p1,manual_review
广州优岸美致时装有限公司,4,广州优岸美致时装有限公司,广州优岸美致时装有限公司,,False,False,False,False,high_risk_manual_review,p1,manual_review
广州卓动信息科技有限公司,4,广州卓动信息科技有限公司,广州卓动信息科技有限公司,卓动科技,True,True,True,False,alias_to_existing_spring_parent,p1,add_alias_mapping
广州导远电子科技有限公司,4,广州导远电子科技有限公司,广州导远电子科技有限公司,,False,False,False,False,high_risk_manual_review,p1,manual_review
广州屈臣氏个人用品商店有限公司,4,广州屈臣氏个人用品商店有限公司,广州屈臣氏个人用品商店有限公司,,False,False,False,False,high_risk_manual_review,p1,manual_review
广州方舟医药有限公司,4,广州方舟医药有限公司,广州方舟医药有限公司,,False,False,False,False,high_risk_manual_review,p1,manual_review
广州诗悦网络科技有限公司,4,广州诗悦网络科技有限公司,广州诗悦网络科技有限公司,诗悦网络--岗位上新,True,True,True,False,alias_to_existing_spring_parent,p1,add_alias_mapping
广州鼎甲计算机科技有限公司,4,广州鼎甲计算机科技有限公司,广州鼎甲计算机科技有限公司,,False,False,False,False,high_risk_manual_review,p1,manual_review
广西扬翔集团股份有限公司,4,广西扬翔集团股份有限公司,广西扬翔集团股份有限公司,,False,False,False,False,high_risk_manual_review,p1,manual_review
建投控股有限责任公司,4,建投控股有限责任公司,建投控股有限责任公司,,False,False,False,False,high_risk_manual_review,p1,manual_review
开开华彩（北京）科技有限公司,4,开开华彩（北京）科技有限公司,开开华彩（北京）科技有限公司,,False,False,False,False,high_risk_manual_review,p1,manual_review
思科（中国）有限公司上海分公司,4,思科（中国）有限公司上海分公司,思科（中国）有限公司,思科,True,True,True,False,alias_to_existing_spring_parent,p1,add_alias_mapping
成都康弘药业集团股份有限公司,4,成都康弘药业集团股份有限公司,成都康弘药业集团股份有限公司,,False,False,False,False,high_risk_manual_review,p1,manual_review
成都零食有鸣商业管理有限公司‌,4,成都零食有鸣商业管理有限公司‌,成都零食有鸣商业管理有限公司‌,零食有鸣,True,True,True,False,alias_to_existing_spring_parent,p1,add_alias_mapping
新天绿色能源股份有限公司,4,新天绿色能源股份有限公司,新天绿色能源股份有限公司,,False,False,False,False,high_risk_manual_review,p1,manual_review
昕原半导体（上海）有限公司,4,昕原半导体（上海）有限公司,昕原半导体（上海）有限公司,昕原半导体,True,True,True,False,alias_to_existing_spring_parent,p1,add_alias_mapping
星宸科技股份有限公司,4,星宸科技股份有限公司,星宸科技股份有限公司,星宸科技,True,True,True,False,alias_to_existing_spring_parent,p1,add_alias_mapping
朗新科技集团股份有限公司,4,朗新科技集团股份有限公司,朗新科技集团股份有限公司,,False,False,False,False,high_risk_manual_review,p1,manual_review
杭州优行科技有限公司,4,杭州优行科技有限公司,杭州优行科技有限公司,,False,False,False,False,high_risk_manual_review,p1,manual_review
杭州天扬机械有限公司,4,杭州天扬机械有限公司,杭州天扬机械有限公司,,False,False,False,False,high_risk_manual_review,p1,manual_review
杭州天谷信息科技有限公司,4,杭州天谷信息科技有限公司,杭州天谷信息科技有限公司,,False,False,False,False,high_risk_manual_review,p1,manual_review
杭州安脉盛智能技术有限公司,4,杭州安脉盛智能技术有限公司,杭州安脉盛智能技术有限公司,安脉盛,True,True,True,False,alias_to_existing_spring_parent,p1,add_alias_mapping
杭州市萧山区人才管理服务中心,4,杭州市萧山区人才管理服务中心,杭州市萧山区人才管理服务中心,,False,False,False,False,high_risk_manual_review,p1,manual_review
杭州联合农村商业银行股份有限公司,4,杭州联合农村商业银行股份有限公司,杭州联合农村商业银行股份有限公司,,False,False,False,False,high_risk_manual_review,p1,manual_review
校宝在线（杭州）科技股份有限公司,4,校宝在线（杭州）科技股份有限公司,校宝在线（杭州）科技股份有限公司,,False,False,False,False,high_risk_manual_review,p1,manual_review
江苏为恒智能科技有限公司,4,江苏为恒智能科技有限公司,江苏为恒智能科技有限公司,,False,False,False,False,high_risk_manual_review,p1,manual_review
沈阳芯源微电子设备股份有限公司,4,沈阳芯源微电子设备股份有限公司,沈阳芯源微电子设备股份有限公司,芯源微,True,True,True,False,alias_to_existing_spring_parent,p1,add_alias_mapping
泰凌微电子（上海）股份有限公司,4,泰凌微电子（上海）股份有限公司,泰凌微电子（上海）股份有限公司,泰凌微电子,True,True,True,False,alias_to_existing_spring_parent,p1,add_alias_mapping
洛阳栾川钼业集团股份有限公司,4,洛阳栾川钼业集团股份有限公司,洛阳栾川钼业集团股份有限公司,,False,False,False,False,high_risk_manual_review,p1,manual_review
浙江出版联合集团有限公司,4,浙江出版联合集团有限公司,浙江出版联合集团有限公司,浙江出版联合集团,True,True,True,False,alias_to_existing_spring_parent,p1,add_alias_mapping
浙江宜格企业管理集团有限公司,4,浙江宜格企业管理集团有限公司,浙江宜格企业管理集团有限公司,,False,False,False,False,high_risk_manual_review,p1,manual_review
浙江森马服饰股份有限公司,4,浙江森马服饰股份有限公司,浙江森马服饰股份有限公司,森马服饰,True,True,True,False,alias_to_existing_spring_parent,p1,add_alias_mapping
浙江裤哇科技有限公司,4,浙江裤哇科技有限公司,浙江裤哇科技有限公司,,False,False,False,False,high_risk_manual_review,p1,manual_review
海南微城未来教育学校,4,海南微城未来教育学校,海南微城未来教育学校,,False,False,False,False,high_risk_manual_review,p1,manual_review
深圳力维智联技术有限公司,4,深圳力维智联技术有限公司,深圳力维智联技术有限公司,力维智联,True,True,True,False,alias_to_existing_spring_parent,p1,add_alias_mapping
深圳壹连科技股份有限公司,4,深圳壹连科技股份有限公司,深圳壹连科技股份有限公司,壹连科技,True,True,True,False,alias_to_existing_spring_parent,p1,add_alias_mapping
深圳太若科技有限公司,4,深圳太若科技有限公司,深圳太若科技有限公司,,False,False,False,False,high_risk_manual_review,p1,manual_review
深圳奥雅设计股份有限公司,4,深圳奥雅设计股份有限公司,深圳奥雅设计股份有限公司,,False,False,False,False,high_risk_manual_review,p1,manual_review
深圳市中图仪器股份有限公司,4,深圳市中图仪器股份有限公司,深圳市中图仪器股份有限公司,中图仪器,True,True,True,False,alias_to_existing_spring_parent,p1,add_alias_mapping
深圳市倍轻松科技股份有限公司,4,深圳市倍轻松科技股份有限公司,深圳市倍轻松科技股份有限公司,,False,False,False,False,high_risk_manual_review,p1,manual_review
深圳市合元科技有限公司,4,深圳市合元科技有限公司,深圳市合元科技有限公司,,False,False,False,False,high_risk_manual_review,p1,manual_review
深圳市国显科技有限公司,4,深圳市国显科技有限公司,深圳市国显科技有限公司,,False,False,False,False,high_risk_manual_review,p1,manual_review
深圳市帝迈生物技术有限公司,4,深圳市帝迈生物技术有限公司,深圳市帝迈生物技术有限公司,帝迈生物,True,True,True,False,alias_to_existing_spring_parent,p1,add_alias_mapping
深圳市水务规划设计院股份有限公司,4,深圳市水务规划设计院股份有限公司,深圳市水务规划设计院股份有限公司,,False,False,False,False,high_risk_manual_review,p1,manual_review
深圳市洲明科技股份有限公司,4,深圳市洲明科技股份有限公司,深圳市洲明科技股份有限公司,,False,False,False,False,high_risk_manual_review,p1,manual_review
深圳市雷赛智能控制股份有限公司,4,深圳市雷赛智能控制股份有限公司,深圳市雷赛智能控制股份有限公司,雷赛智能,True,True,True,False,alias_to_existing_spring_parent,p1,add_alias_mapping
渤海证券股份有限公司,4,渤海证券股份有限公司,渤海证券股份有限公司,,False,False,False,False,high_risk_manual_review,p1,manual_review
湖南视比特机器人有限公司,4,湖南视比特机器人有限公司,湖南视比特机器人有限公司,,False,False,False,False,high_risk_manual_review,p1,manual_review
湖南财信金融控股集团有限公司,4,湖南财信金融控股集团有限公司,湖南财信金融控股集团有限公司,,False,False,False,False,high_risk_manual_review,p1,manual_review
爱客科技（深圳）有限公司,4,爱客科技（深圳）有限公司,爱客科技（深圳）有限公司,,False,False,False,False,high_risk_manual_review,p1,manual_review
爱德华（上海）医疗用品有限公司,4,爱德华（上海）医疗用品有限公司,爱德华（上海）医疗用品有限公司,,False,False,False,False,high_risk_manual_review,p1,manual_review
特赞（上海）信息科技有限公司,4,特赞（上海）信息科技有限公司,特赞（上海）信息科技有限公司,,False,False,False,False,high_risk_manual_review,p1,manual_review
现代前瞻汽车技术开发（上海）有限公司,4,现代前瞻汽车技术开发（上海）有限公司,现代前瞻汽车技术开发（上海）有限公司,,False,False,False,False,high_risk_manual_review,p1,manual_review
瓴创（北京）科技有限公司,4,瓴创（北京）科技有限公司,瓴创（北京）科技有限公司,,False,False,False,False,high_risk_manual_review,p1,manual_review
石药控股集团有限公司,4,石药控股集团有限公司,石药控股集团有限公司,,False,False,False,False,high_risk_manual_review,p1,manual_review
福特汽车（中国）有限公司,4,福特汽车（中国）有限公司,福特汽车（中国）有限公司,,False,False,False,False,high_risk_manual_review,p1,manual_review
福耀玻璃工业集团股份有限公司‌,4,福耀玻璃工业集团股份有限公司‌,福耀玻璃工业集团股份有限公司‌,,False,False,False,False,high_risk_manual_review,p1,manual_review
第一京广投资咨询（深圳）有限公司,4,第一京广投资咨询（深圳）有限公司,第一京广投资咨询（深圳）有限公司,,False,False,False,False,high_risk_manual_review,p1,manual_review
统信软件技术有限公司,4,统信软件技术有限公司,统信软件技术有限公司,,False,False,False,False,high_risk_manual_review,p1,manual_review
绿城房地产建设管理集团有限公司,4,绿城房地产建设管理集团有限公司,绿城房地产建设管理集团有限公司,,False,False,False,False,high_risk_manual_review,p1,manual_review
美赞臣营养品（中国）有限公司,4,美赞臣营养品（中国）有限公司,美赞臣营养品（中国）有限公司,美赞臣,True,True,True,False,alias_to_existing_spring_parent,p1,add_alias_mapping
航天科技集团九院九部,4,航天科技集团九院九部,航天科技集团九院九部,,False,False,False,False,high_risk_manual_review,p1,manual_review
苏州同元软控信息技术有限公司,4,苏州同元软控信息技术有限公司,苏州同元软控信息技术有限公司,,False,False,False,False,high_risk_manual_review,p1,manual_review
苏州艾利特机器人有限公司,4,苏州艾利特机器人有限公司,苏州艾利特机器人有限公司,,False,False,False,False,high_risk_manual_review,p1,manual_review
郑州磨料磨具磨削研究所有限公司,4,郑州磨料磨具磨削研究所有限公司,郑州磨料磨具磨削研究所有限公司,,False,False,False,False,high_risk_manual_review,p1,manual_review
重庆麦芽传媒有限公司,4,重庆麦芽传媒有限公司,重庆麦芽传媒有限公司,,False,False,False,False,high_risk_manual_review,p1,manual_review
鑫方盛数智科技股份有限公司,4,鑫方盛数智科技股份有限公司,鑫方盛数智科技股份有限公司,,False,False,False,False,high_risk_manual_review,p1,manual_review
钜泉光电科技（上海）股份有限公司,4,钜泉光电科技（上海）股份有限公司,钜泉光电科技（上海）股份有限公司,,False,False,False,False,high_risk_manual_review,p1,manual_review
银河基金管理有限公司,4,银河基金管理有限公司,银河基金管理有限公司,,False,False,False,False,high_risk_manual_review,p1,manual_review
雷鸟创新技术（深圳）有限公司,4,雷鸟创新技术（深圳）有限公司,雷鸟创新技术（深圳）有限公司,,False,False,False,False,high_risk_manual_review,p1,manual_review
青岛特锐德电气股份有限公司,4,青岛特锐德电气股份有限公司,青岛特锐德电气股份有限公司,特锐德,True,True,True,False,alias_to_existing_spring_parent,p1,add_alias_mapping
一汽—大众汽车有限公司,3,一汽—大众汽车有限公司,一汽—大众汽车有限公司,大众汽车,True,True,True,False,alias_to_existing_spring_parent,p1,add_alias_mapping
上海保险交易所股份有限公司,3,上海保险交易所股份有限公司,上海保险交易所股份有限公司,,False,False,False,False,high_risk_manual_review,p1,manual_review
上海农村商业银行股份有限公司,3,上海农村商业银行股份有限公司,上海农村商业银行股份有限公司,重庆农村商业银行,True,True,True,False,alias_to_existing_spring_parent,p1,add_alias_mapping
上海华瑞银行股份有限公司,3,上海华瑞银行股份有限公司,上海华瑞银行股份有限公司,上海华瑞银行,True,True,True,False,alias_to_existing_spring_parent,p1,add_alias_mapping
上海司南导航技术股份有限公司,3,上海司南导航技术股份有限公司,上海司南导航技术股份有限公司,司南导航,True,True,True,False,alias_to_existing_spring_parent,p1,add_alias_mapping
上海君实生物医药科技股份有限公司,3,上海君实生物医药科技股份有限公司,上海君实生物医药科技股份有限公司,君实生物,True,True,True,False,alias_to_existing_spring_parent,p1,add_alias_mapping
上海嘉银科技股份有限公司,3,上海嘉银科技股份有限公司,上海嘉银科技股份有限公司,嘉银科技-社招/校招/实习,True,True,True,False,alias_to_existing_spring_parent,p1,add_alias_mapping
上海实业(集团）,3,上海实业(集团）,上海实业(集团）,,False,False,False,False,high_risk_manual_review,p1,manual_review
上海摩瓦新能源科技有限公司,3,上海摩瓦新能源科技有限公司,上海摩瓦新能源科技有限公司,,False,False,False,False,high_risk_manual_review,p1,manual_review
上海永达汽车集团有限公司,3,上海永达汽车集团有限公司,上海永达汽车集团有限公司,,False,False,False,False,high_risk_manual_review,p1,manual_review
上海环世物流（集团）有限公司,3,上海环世物流（集团）有限公司,上海环世物流（集团）有限公司,环世物流,True,True,True,False,alias_to_existing_spring_parent,p1,add_alias_mapping
上海电气泰雷兹交通自动化系统有限公司,3,上海电气泰雷兹交通自动化系统有限公司,上海电气泰雷兹交通自动化系统有限公司,,False,False,False,False,high_risk_manual_review,p1,manual_review
上海电缆研究所有限公司,3,上海电缆研究所有限公司,上海电缆研究所有限公司,,False,False,False,False,high_risk_manual_review,p1,manual_review
上海电驱动股份有限公司,3,上海电驱动股份有限公司,上海电驱动股份有限公司,,False,False,False,False,high_risk_manual_review,p1,manual_review
上海科华生物工程股份有限公司,3,上海科华生物工程股份有限公司,上海科华生物工程股份有限公司,,False,False,False,False,high_risk_manual_review,p1,manual_review
上海肯斯爪特科技有限公司,3,上海肯斯爪特科技有限公司,上海肯斯爪特科技有限公司,,False,False,False,False,high_risk_manual_review,p1,manual_review
上海芯上微装科技股份有限公司,3,上海芯上微装科技股份有限公司,上海芯上微装科技股份有限公司,,False,False,False,False,high_risk_manual_review,p1,manual_review
上海领昱公寓管理有限公司,3,上海领昱公寓管理有限公司,上海领昱公寓管理有限公司,,False,False,False,False,high_risk_manual_review,p1,manual_review
上海高顿教育科技有限公司,3,上海高顿教育科技有限公司,上海高顿教育科技有限公司,武汉高顿教育,True,True,True,False,alias_to_existing_spring_parent,p1,add_alias_mapping
上海黑湖网络科技有限公司,3,上海黑湖网络科技有限公司,上海黑湖网络科技有限公司,,False,False,False,False,high_risk_manual_review,p1,manual_review
东莞领益精密制造科技有限公司,3,东莞领益精密制造科技有限公司,东莞领益精密制造科技有限公司,,False,False,False,False,high_risk_manual_review,p1,manual_review
中信建投期货有限公司,3,中信建投期货有限公司,中信建投期货有限公司,,False,False,False,False,high_risk_manual_review,p1,manual_review
中华联合保险集团股份有限公司,3,中华联合保险集团股份有限公司,中华联合保险集团股份有限公司,,False,False,False,False,high_risk_manual_review,p1,manual_review
中国—东盟信息港股份有限公司,3,中国—东盟信息港股份有限公司,中国—东盟信息港股份有限公司,,False,False,False,False,high_risk_manual_review,p1,manual_review
中国东方资产管理股份有限公司,3,中国东方资产管理股份有限公司,中国东方资产管理股份有限公司,,False,False,False,False,high_risk_manual_review,p1,manual_review
中国中铁股份有限公司,3,中国中铁股份有限公司,中国中铁股份有限公司,,False,False,False,False,high_risk_manual_review,p1,manual_review
中国兵工物资集团有限公司,3,中国兵工物资集团有限公司,中国兵工物资集团有限公司,,False,False,False,False,high_risk_manual_review,p1,manual_review
中国有研科技集团有限公司,3,中国有研科技集团有限公司,中国有研科技集团有限公司,中国有研科技集团,True,True,True,False,alias_to_existing_spring_parent,p1,add_alias_mapping
中国有色矿业集团有限公司,3,中国有色矿业集团有限公司,中国有色矿业集团有限公司,,False,False,False,False,high_risk_manual_review,p1,manual_review
中国煤炭科工集团有限公司,3,中国煤炭科工集团有限公司,中国煤炭科工集团有限公司,,False,False,False,False,high_risk_manual_review,p1,manual_review
中国盐业集团有限公司,3,中国盐业集团有限公司,中国盐业集团有限公司,,False,False,False,False,high_risk_manual_review,p1,manual_review
中国能源建设集团广东火电工程有限公司,3,中国能源建设集团广东火电工程有限公司,中国能源建设集团广东火电工程有限公司,,False,False,False,False,high_risk_manual_review,p1,manual_review
中核控制系统工程有限公司,3,中核控制系统工程有限公司,中核控制系统工程有限公司,,False,False,False,False,high_risk_manual_review,p1,manual_review
中汇管理咨询,3,中汇管理咨询,中汇管理咨询,中汇,True,True,True,False,alias_to_existing_spring_parent,p1,add_alias_mapping
中电信量子信息科技集团有限公司,3,中电信量子信息科技集团有限公司,中电信量子信息科技集团有限公司,,False,False,False,False,high_risk_manual_review,p1,manual_review
中电建新能源集团股份有限公司,3,中电建新能源集团股份有限公司,中电建新能源集团股份有限公司,,False,False,False,False,high_risk_manual_review,p1,manual_review
中电建路桥集团有限公司,3,中电建路桥集团有限公司,中电建路桥集团有限公司,,False,False,False,False,high_risk_manual_review,p1,manual_review
中科芯集成电路有限公司,3,中科芯集成电路有限公司,中科芯集成电路有限公司,中科芯,True,True,True,False,alias_to_existing_spring_parent,p1,add_alias_mapping
中移动信息技术有限公司,3,中移动信息技术有限公司,中移动信息技术有限公司,,False,False,False,False,high_risk_manual_review,p1,manual_review
中移（成都）信息通信科技有限公司,3,中移（成都）信息通信科技有限公司,中移（成都）信息通信科技有限公司,,False,False,False,False,high_risk_manual_review,p1,manual_review
中粮可口可乐饮料（中国）投资有限公司,3,中粮可口可乐饮料（中国）投资有限公司,中粮可口可乐饮料（中国）投资有限公司,,False,False,False,False,high_risk_manual_review,p1,manual_review
乐福思健康产业股份公司,3,乐福思健康产业股份公司,乐福思健康产业股份公司,,False,False,False,False,high_risk_manual_review,p1,manual_review
五矿资产经营管理有限公司,3,五矿资产经营管理有限公司,五矿资产经营管理有限公司,,False,False,False,False,high_risk_manual_review,p1,manual_review
信银理财有限责任公司,3,信银理财有限责任公司,信银理财有限责任公司,,False,False,False,False,high_risk_manual_review,p1,manual_review
信雅达科技股份有限公司,3,信雅达科技股份有限公司,信雅达科技股份有限公司,信雅达,True,True,True,False,alias_to_existing_spring_parent,p1,add_alias_mapping
元保保险经纪（北京）有限公司,3,元保保险经纪（北京）有限公司,元保保险经纪（北京）有限公司,,False,False,False,False,high_risk_manual_review,p1,manual_review
农信银资金清算中心有限责任公司,3,农信银资金清算中心有限责任公司,农信银资金清算中心有限责任公司,,False,False,False,False,high_risk_manual_review,p1,manual_review
北京三五二环保科技有限公司,3,北京三五二环保科技有限公司,北京三五二环保科技有限公司,,False,False,False,False,high_risk_manual_review,p1,manual_review
北京亦庄国际投资发展有限公司,3,北京亦庄国际投资发展有限公司,北京亦庄国际投资发展有限公司,,False,False,False,False,high_risk_manual_review,p1,manual_review
北京京城机电控股有限责任公司,3,北京京城机电控股有限责任公司,北京京城机电控股有限责任公司,京城机电,True,True,True,False,alias_to_existing_spring_parent,p1,add_alias_mapping
北京农村商业银行股份有限公司,3,北京农村商业银行股份有限公司,北京农村商业银行股份有限公司,重庆农村商业银行,True,True,True,False,alias_to_existing_spring_parent,p1,add_alias_mapping
北京外企德科人力资源服务上海有限公司,3,北京外企德科人力资源服务上海有限公司,北京外企德科人力资源服务上海有限公司,,False,False,False,False,high_risk_manual_review,p1,manual_review
北京市金杜律师事务所,3,北京市金杜律师事务所,北京市金杜律师事务所,,False,False,False,False,high_risk_manual_review,p1,manual_review
北京建龙重工集团有限公司,3,北京建龙重工集团有限公司,北京建龙重工集团有限公司,,False,False,False,False,high_risk_manual_review,p1,manual_review
北京深言科技有限责任公司,3,北京深言科技有限责任公司,北京深言科技有限责任公司,,False,False,False,False,high_risk_manual_review,p1,manual_review
北京环境卫生工程集团有限公司,3,北京环境卫生工程集团有限公司,北京环境卫生工程集团有限公司,,False,False,False,False,high_risk_manual_review,p1,manual_review
北京米连科技有限公司,3,北京米连科技有限公司,北京米连科技有限公司,,False,False,False,False,high_risk_manual_review,p1,manual_review
北京蓝箭鸿擎科技有限公司,3,北京蓝箭鸿擎科技有限公司,北京蓝箭鸿擎科技有限公司,,False,False,False,False,high_risk_manual_review,p1,manual_review
北京融世纪信息技术有限公司,3,北京融世纪信息技术有限公司,北京融世纪信息技术有限公司,,False,False,False,False,high_risk_manual_review,p1,manual_review
