tata_company,tata_rows,normalized_name,inferred_parent,recommended_parent,in_spring_canonical,in_spring_aliases,in_spring_entity_members,in_base_only,fix_bucket,priority,recommended_action
上海万木生源家居有限公司,1,上海万木生源家居有限公司,上海万木生源家居有限公司,,False,False,False,False,high_risk_manual_review,p1,manual_review
上海中汇亿达金融信息技术有限公司,1,上海中汇亿达金融信息技术有限公司,上海中汇亿达金融信息技术有限公司,中汇,True,True,True,False,alias_to_existing_spring_parent,p1,add_alias_mapping
上海众华财务咨询有限公司,1,上海众华财务咨询有限公司,上海众华财务咨询有限公司,,False,False,False,False,high_risk_manual_review,p1,manual_review
上海保立佳化工股份有限公司,1,上海保立佳化工股份有限公司,上海保立佳化工股份有限公司,,False,False,False,False,high_risk_manual_review,p1,manual_review
上海几何伙伴智能驾驶有限公司,1,上海几何伙伴智能驾驶有限公司,上海几何伙伴智能驾驶有限公司,,False,False,False,False,high_risk_manual_review,p1,manual_review
上海凯泉泵业（集团）有限公司,1,上海凯泉泵业（集团）有限公司,上海凯泉泵业（集团）有限公司,,False,False,False,False,high_risk_manual_review,p1,manual_review
上海创思企业发展有限公司,1,上海创思企业发展有限公司,上海创思企业发展有限公司,,False,False,False,False,high_risk_manual_review,p1,manual_review
上海千象资产管理有限公司,1,上海千象资产管理有限公司,上海千象资产管理有限公司,,False,False,False,False,high_risk_manual_review,p1,manual_review
上海友塔网络科技有限公司,1,上海友塔网络科技有限公司,上海友塔网络科技有限公司,,False,False,False,False,high_risk_manual_review,p1,manual_review
上海友道智途科技有限公司,1,上海友道智途科技有限公司,上海友道智途科技有限公司,,False,False,False,False,high_risk_manual_review,p1,manual_review
上海同余信息科技有限公司,1,上海同余信息科技有限公司,上海同余信息科技有限公司,,False,False,False,False,high_risk_manual_review,p1,manual_review
上海商泰汽车信息系统有限公司,1,上海商泰汽车信息系统有限公司,上海商泰汽车信息系统有限公司,,False,False,False,False,high_risk_manual_review,p1,manual_review
上海喜岳投资管理有限公司,1,上海喜岳投资管理有限公司,上海喜岳投资管理有限公司,喜岳投资,True,True,True,False,alias_to_existing_spring_parent,p1,add_alias_mapping
上海回天新材料有限公司,1,上海回天新材料有限公司,上海回天新材料有限公司,,False,False,False,False,high_risk_manual_review,p1,manual_review
上海复宏汉霖生物技术股份有限公司,1,上海复宏汉霖生物技术股份有限公司,上海复宏汉霖生物技术股份有限公司,复宏汉霖,True,True,True,False,alias_to_existing_spring_parent,p1,add_alias_mapping
上海复星旅游管理有限公司,1,上海复星旅游管理有限公司,上海复星旅游管理有限公司,复星,True,True,True,False,alias_to_existing_spring_parent,p1,add_alias_mapping
上海姚记潮品玩具有限公司,1,上海姚记潮品玩具有限公司,上海姚记潮品玩具有限公司,,False,False,False,False,high_risk_manual_review,p1,manual_review
上海宝龙实业发展（集团）有限公司,1,上海宝龙实业发展（集团）有限公司,上海宝龙实业发展（集团）有限公司,,False,False,False,False,high_risk_manual_review,p1,manual_review
上海尚诚消费金融股份有限公司,1,上海尚诚消费金融股份有限公司,上海尚诚消费金融股份有限公司,,False,False,False,False,high_risk_manual_review,p1,manual_review
上海意略明数字科技股份有限公司,1,上海意略明数字科技股份有限公司,上海意略明数字科技股份有限公司,意略明,True,True,True,False,alias_to_existing_spring_parent,p1,add_alias_mapping
上海拿森汽车电子股份有限公司,1,上海拿森汽车电子股份有限公司,上海拿森汽车电子股份有限公司,,False,False,False,False,high_risk_manual_review,p1,manual_review
上海摄提信息科技有限公司,1,上海摄提信息科技有限公司,上海摄提信息科技有限公司,,False,False,False,False,high_risk_manual_review,p1,manual_review
上海新傲科技股份有限公司,1,上海新傲科技股份有限公司,上海新傲科技股份有限公司,,False,False,False,False,high_risk_manual_review,p1,manual_review
上海无涯私募基金管理有限公司,1,上海无涯私募基金管理有限公司,上海无涯私募基金管理有限公司,,False,False,False,False,high_risk_manual_review,p1,manual_review
上海易咖智车科技有限公司,1,上海易咖智车科技有限公司,上海易咖智车科技有限公司,,False,False,False,False,high_risk_manual_review,p1,manual_review
上海机动车检测认证技术研究中心有限公司,1,上海机动车检测认证技术研究中心有限公司,上海机动车检测认证技术研究中心有限公司,,False,False,False,False,high_risk_manual_review,p1,manual_review
上海来伊份股份有限公司,1,上海来伊份股份有限公司,上海来伊份股份有限公司,,False,False,False,False,high_risk_manual_review,p1,manual_review
上海格思航天科技有限公司,1,上海格思航天科技有限公司,上海格思航天科技有限公司,,False,False,False,False,high_risk_manual_review,p1,manual_review
上海楷登电子科技有限公司,1,上海楷登电子科技有限公司,上海楷登电子科技有限公司,,False,False,False,False,high_risk_manual_review,p1,manual_review
上海橘宜化妆品有限公司,1,上海橘宜化妆品有限公司,上海橘宜化妆品有限公司,,False,False,False,False,high_risk_manual_review,p1,manual_review
上海正帆科技股份有限公司,1,上海正帆科技股份有限公司,上海正帆科技股份有限公司,,False,False,False,False,high_risk_manual_review,p1,manual_review
上海泓明供应链有限公司,1,上海泓明供应链有限公司,上海泓明供应链有限公司,,False,False,False,False,high_risk_manual_review,p1,manual_review
上海海隆赛能新材料有限公司,1,上海海隆赛能新材料有限公司,上海海隆赛能新材料有限公司,,False,False,False,False,high_risk_manual_review,p1,manual_review
上海海隆软件股份有限公司,1,上海海隆软件股份有限公司,上海海隆软件股份有限公司,,False,False,False,False,high_risk_manual_review,p1,manual_review
上海淼绣科技有限公司,1,上海淼绣科技有限公司,上海淼绣科技有限公司,,False,False,False,False,high_risk_manual_review,p1,manual_review
上海申能新能源投资有限公司,1,上海申能新能源投资有限公司,上海申能新能源投资有限公司,,False,False,False,False,high_risk_manual_review,p1,manual_review
上海电气核电集团有限公司,1,上海电气核电集团有限公司,上海电气核电集团有限公司,上海电气核电集团,True,True,True,False,alias_to_existing_spring_parent,p1,add_alias_mapping
上海电气风电集团股份有限公司,1,上海电气风电集团股份有限公司,上海电气风电集团股份有限公司,,False,False,False,False,high_risk_manual_review,p1,manual_review
上海皓元医药股份有限公司,1,上海皓元医药股份有限公司,上海皓元医药股份有限公司,皓元医药,True,True,True,False,alias_to_existing_spring_parent,p1,add_alias_mapping
上海相寓企业集团有限公司,1,上海相寓企业集团有限公司,上海相寓企业集团有限公司,,False,False,False,False,high_risk_manual_review,p1,manual_review
上海神开石油化工装备股份有限公司,1,上海神开石油化工装备股份有限公司,上海神开石油化工装备股份有限公司,神开,True,True,True,False,alias_to_existing_spring_parent,p1,add_alias_mapping
上海素然服饰有限公司,1,上海素然服饰有限公司,上海素然服饰有限公司,,False,False,False,False,high_risk_manual_review,p1,manual_review
上海纵苇科技有限公司,1,上海纵苇科技有限公司,上海纵苇科技有限公司,,False,False,False,False,high_risk_manual_review,p1,manual_review
上海维宏电子科技股份有限公司,1,上海维宏电子科技股份有限公司,上海维宏电子科技股份有限公司,,False,False,False,False,high_risk_manual_review,p1,manual_review
上海缙嘉科技有限公司,1,上海缙嘉科技有限公司,上海缙嘉科技有限公司,,False,False,False,False,high_risk_manual_review,p1,manual_review
上海美术馆,1,上海美术馆,上海美术馆,,False,False,False,False,high_risk_manual_review,p1,manual_review
上海群贤工贸发展有限公司,1,上海群贤工贸发展有限公司,上海群贤工贸发展有限公司,群贤,True,True,True,False,alias_to_existing_spring_parent,p1,add_alias_mapping
上海联创设计集团股份有限公司,1,上海联创设计集团股份有限公司,上海联创设计集团股份有限公司,,False,False,False,False,high_risk_manual_review,p1,manual_review
上海能良电子科技有限公司,1,上海能良电子科技有限公司,上海能良电子科技有限公司,,False,False,False,False,high_risk_manual_review,p1,manual_review
上海莱士血液制品股份有限公司,1,上海莱士血液制品股份有限公司,上海莱士血液制品股份有限公司,,False,False,False,False,high_risk_manual_review,p1,manual_review
上海近观科技有限责任公司,1,上海近观科技有限责任公司,上海近观科技有限责任公司,,False,False,False,False,high_risk_manual_review,p1,manual_review
上海锦湖日丽塑料有限公司,1,上海锦湖日丽塑料有限公司,上海锦湖日丽塑料有限公司,锦湖日丽,True,True,True,False,alias_to_existing_spring_parent,p1,add_alias_mapping
上海集优机械有限公司,1,上海集优机械有限公司,上海集优机械有限公司,,False,False,False,False,high_risk_manual_review,p1,manual_review
上海预见诚功人力资源有限责任公司,1,上海预见诚功人力资源有限责任公司,上海预见诚功人力资源有限责任公司,,False,False,False,False,high_risk_manual_review,p1,manual_review
上海魔方泛文化娱乐集团有限公司,1,上海魔方泛文化娱乐集团有限公司,上海魔方泛文化娱乐集团有限公司,,False,False,False,False,high_risk_manual_review,p1,manual_review
上海麦克风文化传媒有限公司,1,上海麦克风文化传媒有限公司,上海麦克风文化传媒有限公司,,False,False,False,False,high_risk_manual_review,p1,manual_review
不凡帝范梅勒糖果（中国）有限公司,1,不凡帝范梅勒糖果（中国）有限公司,不凡帝范梅勒糖果（中国）有限公司,不凡帝范梅勒,True,True,True,False,alias_to_existing_spring_parent,p1,add_alias_mapping
东方海外货柜航运（中国）有限公司,1,东方海外货柜航运（中国）有限公司,东方海外货柜航运（中国）有限公司,,False,False,False,False,high_risk_manual_review,p1,manual_review
东方甄选（北京）科技有限公司,1,东方甄选（北京）科技有限公司,东方甄选（北京）科技有限公司,,False,False,False,False,high_risk_manual_review,p1,manual_review
东莞市兆显电子科技有限公司,1,东莞市兆显电子科技有限公司,东莞市兆显电子科技有限公司,,False,False,False,False,high_risk_manual_review,p1,manual_review
中乔体育股份有限公司,1,中乔体育股份有限公司,中乔体育股份有限公司,中乔体育,True,True,True,False,alias_to_existing_spring_parent,p1,add_alias_mapping
中信信托有限责任公司,1,中信信托有限责任公司,中信信托有限责任公司,中信信托,True,True,True,False,alias_to_existing_spring_parent,p1,add_alias_mapping
中信消费金融有限公司,1,中信消费金融有限公司,中信消费金融有限公司,,False,False,False,False,high_risk_manual_review,p1,manual_review
中信金融租赁有限公司,1,中信金融租赁有限公司,中信金融租赁有限公司,,False,False,False,False,high_risk_manual_review,p1,manual_review
中元汇吉生物技术股份有限公司,1,中元汇吉生物技术股份有限公司,中元汇吉生物技术股份有限公司,,False,False,False,False,high_risk_manual_review,p1,manual_review
中共池州市委组织部,1,中共池州市委组织部,中共池州市委组织部,,False,False,False,False,high_risk_manual_review,p1,manual_review
中关村空间信息产业技术联盟,1,中关村空间信息产业技术联盟,中关村空间信息产业技术联盟,,False,False,False,False,high_risk_manual_review,p1,manual_review
中兴光电子技术有限公司,1,中兴光电子技术有限公司,中兴光电子技术有限公司,,False,False,False,False,high_risk_manual_review,p1,manual_review
中冠工程管理咨询有限公司,1,中冠工程管理咨询有限公司,中冠工程管理咨询有限公司,,False,False,False,False,high_risk_manual_review,p1,manual_review
中冶建筑研究总院有限公司,1,中冶建筑研究总院有限公司,中冶建筑研究总院有限公司,,False,False,False,False,high_risk_manual_review,p1,manual_review
中创软件工程股份有限公司,1,中创软件工程股份有限公司,中创软件工程股份有限公司,,False,False,False,False,high_risk_manual_review,p1,manual_review
中南出版传媒集团股份有限公司,1,中南出版传媒集团股份有限公司,中南出版传媒集团股份有限公司,,False,False,False,False,high_risk_manual_review,p1,manual_review
中博信息技术研究院有限公司,1,中博信息技术研究院有限公司,中博信息技术研究院有限公司,中博研究院,True,True,True,False,alias_to_existing_spring_parent,p1,add_alias_mapping
中原信托有限公司,1,中原信托有限公司,中原信托有限公司,,False,False,False,False,high_risk_manual_review,p1,manual_review
中国三峡新能源（集团）股份有限公司,1,中国三峡新能源（集团）股份有限公司,中国三峡新能源（集团）股份有限公司,,False,False,False,False,high_risk_manual_review,p1,manual_review
中国中材国际工程股份有限公司,1,中国中材国际工程股份有限公司,中国中材国际工程股份有限公司,中材国际,True,True,True,False,alias_to_existing_spring_parent,p1,add_alias_mapping
中国人民解放军第五七一九工厂,1,中国人民解放军第五七一九工厂,中国人民解放军第五七一九工厂,,False,False,False,False,high_risk_manual_review,p1,manual_review
中国共产主义青年团四川省委员会,1,中国共产主义青年团四川省委员会,中国共产主义青年团四川省委员会,,False,False,False,False,high_risk_manual_review,p1,manual_review
中国化学工程第四建设有限公司,1,中国化学工程第四建设有限公司,中国化学工程第四建设有限公司,,False,False,False,False,high_risk_manual_review,p1,manual_review
中国十九冶集团有限公司,1,中国十九冶集团有限公司,中国十九冶集团有限公司,中国十九冶,True,True,True,False,alias_to_existing_spring_parent,p1,add_alias_mapping
中国华戎科技集团有限公司,1,中国华戎科技集团有限公司,中国华戎科技集团有限公司,,False,False,False,False,high_risk_manual_review,p1,manual_review
中国南玻集团股份有限公司,1,中国南玻集团股份有限公司,中国南玻集团股份有限公司,,False,False,False,False,high_risk_manual_review,p1,manual_review
中国大唐集团有限公司,1,中国大唐集团有限公司,中国大唐集团有限公司,,False,False,False,False,high_risk_manual_review,p1,manual_review
中国建筑一局（集团）有限公司,1,中国建筑一局（集团）有限公司,中国建筑一局（集团）有限公司,,False,False,False,False,high_risk_manual_review,p1,manual_review
中国建筑出版传媒有限公司,1,中国建筑出版传媒有限公司,中国建筑出版传媒有限公司,,False,False,False,False,high_risk_manual_review,p1,manual_review
中国建设科技集团股份有限公司,1,中国建设科技集团股份有限公司,中国建设科技集团股份有限公司,,False,False,False,False,high_risk_manual_review,p1,manual_review
中国有线电视网络有限公司,1,中国有线电视网络有限公司,中国有线电视网络有限公司,,False,False,False,False,high_risk_manual_review,p1,manual_review
中国民航机场建设集团有限公司,1,中国民航机场建设集团有限公司,中国民航机场建设集团有限公司,,False,False,False,False,high_risk_manual_review,p1,manual_review
中国水利水电第七工程局有限公司,1,中国水利水电第七工程局有限公司,中国水利水电第七工程局有限公司,,False,False,False,False,high_risk_manual_review,p1,manual_review
中国江苏国际经济技术合作集团有限公司,1,中国江苏国际经济技术合作集团有限公司,中国江苏国际经济技术合作集团有限公司,,False,False,False,False,high_risk_manual_review,p1,manual_review
中国烟草总公司广东省公司,1,中国烟草总公司广东省公司,中国烟草总公司广东省公司,,False,False,False,False,high_risk_manual_review,p1,manual_review
中国瑞林工程技术股份有限公司,1,中国瑞林工程技术股份有限公司,中国瑞林工程技术股份有限公司,,False,False,False,False,high_risk_manual_review,p1,manual_review
中国稀土集团有限公司,1,中国稀土集团有限公司,中国稀土集团有限公司,中国稀土集团,True,True,True,False,alias_to_existing_spring_parent,p1,add_alias_mapping
中国第一汽车股份有限公司,1,中国第一汽车股份有限公司,中国第一汽车股份有限公司,,False,False,False,False,high_risk_manual_review,p1,manual_review
中国能源建设集团天津电力建设有限公司,1,中国能源建设集团天津电力建设有限公司,中国能源建设集团天津电力建设有限公司,,False,False,False,False,high_risk_manual_review,p1,manual_review
中国航空器材集团有限公司,1,中国航空器材集团有限公司,中国航空器材集团有限公司,,False,False,False,False,high_risk_manual_review,p1,manual_review
中国葛洲坝集团市政工程有限公司,1,中国葛洲坝集团市政工程有限公司,中国葛洲坝集团市政工程有限公司,,False,False,False,False,high_risk_manual_review,p1,manual_review
中国诚通控股集团有限公司,1,中国诚通控股集团有限公司,中国诚通控股集团有限公司,中国诚通控股集团,True,True,True,False,alias_to_existing_spring_parent,p1,add_alias_mapping
中国邮政集团有限公司北京市分公司,1,中国邮政集团有限公司北京市分公司,中国邮政集团有限公司,,False,False,False,False,high_risk_manual_review,p1,manual_review
中国邮政集团有限公司浙江省分公司,1,中国邮政集团有限公司浙江省分公司,中国邮政集团有限公司,,False,False,False,False,high_risk_manual_review,p1,manual_review
中国金茂（集团）有限公司,1,中国金茂（集团）有限公司,中国金茂（集团）有限公司,中国金茂,True,True,True,False,alias_to_existing_spring_parent,p1,add_alias_mapping
中国飞机强度研究所,1,中国飞机强度研究所,中国飞机强度研究所,,False,False,False,False,high_risk_manual_review,p1,manual_review
中基宁波集团股份有限公司,1,中基宁波集团股份有限公司,中基宁波集团股份有限公司,,False,False,False,False,high_risk_manual_review,p1,manual_review
中宏人寿保险有限公司,1,中宏人寿保险有限公司,中宏人寿保险有限公司,,False,False,False,False,high_risk_manual_review,p1,manual_review
中庚基金管理有限公司,1,中庚基金管理有限公司,中庚基金管理有限公司,,False,False,False,False,high_risk_manual_review,p1,manual_review
中建八局轨道交通建设有限公司,1,中建八局轨道交通建设有限公司,中建八局轨道交通建设有限公司,,False,False,False,False,high_risk_manual_review,p1,manual_review
中建桥梁有限公司,1,中建桥梁有限公司,中建桥梁有限公司,,False,False,False,False,high_risk_manual_review,p1,manual_review
中新天津生态城人力资源和社会保障局,1,中新天津生态城人力资源和社会保障局,中新天津生态城人力资源和社会保障局,,False,False,False,False,high_risk_manual_review,p1,manual_review
中智管理咨询有限公司,1,中智管理咨询有限公司,中智管理咨询有限公司,,False,False,False,False,high_risk_manual_review,p1,manual_review
中材科技股份有限公司,1,中材科技股份有限公司,中材科技股份有限公司,,False,False,False,False,high_risk_manual_review,p1,manual_review
中油碧辟石油有限公司,1,中油碧辟石油有限公司,中油碧辟石油有限公司,,False,False,False,False,high_risk_manual_review,p1,manual_review
中电国瑞供应链管理有限公司,1,中电国瑞供应链管理有限公司,中电国瑞供应链管理有限公司,,False,False,False,False,high_risk_manual_review,p1,manual_review
中电科光电科技有限公司,1,中电科光电科技有限公司,中电科光电科技有限公司,,False,False,False,False,high_risk_manual_review,p1,manual_review
中电科航空电子有限公司,1,中电科航空电子有限公司,中电科航空电子有限公司,,False,False,False,False,high_risk_manual_review,p1,manual_review
中石化上海工程有限公司,1,中石化上海工程有限公司,中石化上海工程有限公司,,False,False,False,False,high_risk_manual_review,p1,manual_review
中科信工程咨询（北京）有限责任公司,1,中科信工程咨询（北京）有限责任公司,中科信工程咨询（北京）有限责任公司,,False,False,False,False,high_risk_manual_review,p1,manual_review
中移九天人工智能科技（北京）有限公司,1,中移九天人工智能科技（北京）有限公司,中移九天人工智能科技（北京）有限公司,,False,False,False,False,high_risk_manual_review,p1,manual_review
中移物联网有限公司,1,中移物联网有限公司,中移物联网有限公司,,False,False,False,False,high_risk_manual_review,p1,manual_review
中粮资本控股股份有限公司,1,中粮资本控股股份有限公司,中粮资本控股股份有限公司,中粮资本,True,True,True,False,alias_to_existing_spring_parent,p1,add_alias_mapping
中航天水飞机工业有限责任公司,1,中航天水飞机工业有限责任公司,中航天水飞机工业有限责任公司,,False,False,False,False,high_risk_manual_review,p1,manual_review
中船第九设计研究院工程有限公司,1,中船第九设计研究院工程有限公司,中船第九设计研究院工程有限公司,,False,False,False,False,high_risk_manual_review,p1,manual_review
中车国际有限公司,1,中车国际有限公司,中车国际有限公司,,False,False,False,False,high_risk_manual_review,p1,manual_review
中车大同电力机车有限公司,1,中车大同电力机车有限公司,中车大同电力机车有限公司,,False,False,False,False,high_risk_manual_review,p1,manual_review
中车戚墅堰机车车辆工艺研究所股份有限公司,1,中车戚墅堰机车车辆工艺研究所股份有限公司,中车戚墅堰机车车辆工艺研究所股份有限公司,,False,False,False,False,high_risk_manual_review,p1,manual_review
中车数智科技（雄安）有限公司,1,中车数智科技（雄安）有限公司,中车数智科技（雄安）有限公司,,False,False,False,False,high_risk_manual_review,p1,manual_review
中通快递股份有限公司,1,中通快递股份有限公司,中通快递股份有限公司,中通快递,True,True,True,False,alias_to_existing_spring_parent,p1,add_alias_mapping
中铁山桥集团有限公司,1,中铁山桥集团有限公司,中铁山桥集团有限公司,,False,False,False,False,high_risk_manual_review,p1,manual_review
中铁建设集团北京工程有限公司,1,中铁建设集团北京工程有限公司,中铁建设集团北京工程有限公司,,False,False,False,False,high_risk_manual_review,p1,manual_review
中铁物贸集团有限公司,1,中铁物贸集团有限公司,中铁物贸集团有限公司,,False,False,False,False,high_risk_manual_review,p1,manual_review
丹纳赫（上海）企业管理有限公司,1,丹纳赫（上海）企业管理有限公司,丹纳赫（上海）企业管理有限公司,丹纳赫,True,True,True,False,alias_to_existing_spring_parent,p1,add_alias_mapping
丽珠医药集团股份有限公司,1,丽珠医药集团股份有限公司,丽珠医药集团股份有限公司,,False,False,False,False,high_risk_manual_review,p1,manual_review
九元航空有限公司,1,九元航空有限公司,九元航空有限公司,,False,False,False,False,high_risk_manual_review,p1,manual_review
九毛九（广州）控股有限公司,1,九毛九（广州）控股有限公司,九毛九（广州）控股有限公司,,False,False,False,False,high_risk_manual_review,p1,manual_review
九牧王股份有限公司,1,九牧王股份有限公司,九牧王股份有限公司,JOEONE九牧王,True,True,True,False,alias_to_existing_spring_parent,p1,add_alias_mapping
九芝堂股份有限公司,1,九芝堂股份有限公司,九芝堂股份有限公司,,False,False,False,False,high_risk_manual_review,p1,manual_review
云智慧（北京）科技有限公司,1,云智慧（北京）科技有限公司,云智慧（北京）科技有限公司,,False,False,False,False,high_risk_manual_review,p1,manual_review
