tata_company,tata_rows,normalized_name,inferred_parent,recommended_parent,in_spring_canonical,in_spring_aliases,in_spring_entity_members,in_base_only,fix_bucket,priority,recommended_action
北京值得买科技股份有限公司,10,北京值得买科技股份有限公司,北京值得买科技股份有限公司,,False,False,False,False,high_risk_manual_review,p1,manual_review
北京口袋时尚科技有限公司,10,北京口袋时尚科技有限公司,北京口袋时尚科技有限公司,,False,False,False,False,high_risk_manual_review,p1,manual_review
北京平凯星辰科技发展有限公司,10,北京平凯星辰科技发展有限公司,北京平凯星辰科技发展有限公司,,False,False,False,False,high_risk_manual_review,p1,manual_review
北京微步在线科技有限公司,10,北京微步在线科技有限公司,北京微步在线科技有限公司,北京微步在线,True,True,True,False,alias_to_existing_spring_parent,p1,add_alias_mapping
北京转转精神科技有限责任公司,10,北京转转精神科技有限责任公司,北京转转精神科技有限责任公司,,False,False,False,False,high_risk_manual_review,p1,manual_review
北京辉羲智能信息技术有限公司,10,北京辉羲智能信息技术有限公司,北京辉羲智能信息技术有限公司,,False,False,False,False,high_risk_manual_review,p1,manual_review
北京阿丘科技有限公司,10,北京阿丘科技有限公司,北京阿丘科技有限公司,,False,False,False,False,high_risk_manual_review,p1,manual_review
华域视觉科技（上海）有限公司,10,华域视觉科技（上海）有限公司,华域视觉科技（上海）有限公司,华域视觉,True,True,True,False,alias_to_existing_spring_parent,p1,add_alias_mapping
合肥市大数据资产运营有限公司,10,合肥市大数据资产运营有限公司,合肥市大数据资产运营有限公司,,False,False,False,False,high_risk_manual_review,p1,manual_review
广州工业投资控股集团有限公司,10,广州工业投资控股集团有限公司,广州工业投资控股集团有限公司,,False,False,False,False,high_risk_manual_review,p1,manual_review
广州朗国电子科技股份有限公司,10,广州朗国电子科技股份有限公司,广州朗国电子科技股份有限公司,,False,False,False,False,high_risk_manual_review,p1,manual_review
广州海格通信集团股份有限公司,10,广州海格通信集团股份有限公司,广州海格通信集团股份有限公司,,False,False,False,False,high_risk_manual_review,p1,manual_review
广西玉柴机器集团有限公司,10,广西玉柴机器集团有限公司,广西玉柴机器集团有限公司,,False,False,False,False,high_risk_manual_review,p1,manual_review
弘毅投资（北京）有限公司,10,弘毅投资（北京）有限公司,弘毅投资（北京）有限公司,,False,False,False,False,high_risk_manual_review,p1,manual_review
招商局工业集团有限公司,10,招商局工业集团有限公司,招商局工业集团有限公司,招商局工业集团,True,True,True,False,alias_to_existing_spring_parent,p1,add_alias_mapping
拜耳（中国）有限公司,10,拜耳（中国）有限公司,拜耳（中国）有限公司,拜耳,True,True,True,False,alias_to_existing_spring_parent,p1,add_alias_mapping
新奥集团股份有限公司,10,新奥集团股份有限公司,新奥集团股份有限公司,,False,False,False,False,high_risk_manual_review,p1,manual_review
普源精电科技股份有限公司,10,普源精电科技股份有限公司,普源精电科技股份有限公司,,False,False,False,False,high_risk_manual_review,p1,manual_review
智洋创新科技股份有限公司,10,智洋创新科技股份有限公司,智洋创新科技股份有限公司,智洋创新,True,True,True,False,alias_to_existing_spring_parent,p1,add_alias_mapping
杭州炎魂网络科技有限公司,10,杭州炎魂网络科技有限公司,杭州炎魂网络科技有限公司,杭州炎魂网络,True,True,True,False,alias_to_existing_spring_parent,p1,add_alias_mapping
海恩斯莫里斯（上海）商业有限公司,10,海恩斯莫里斯（上海）商业有限公司,海恩斯莫里斯（上海）商业有限公司,,False,False,False,False,high_risk_manual_review,p1,manual_review
深圳奥尼电子股份有限公司,10,深圳奥尼电子股份有限公司,深圳奥尼电子股份有限公司,,False,False,False,False,high_risk_manual_review,p1,manual_review
深圳威迈斯新能源（集团）股份有限公司,10,深圳威迈斯新能源（集团）股份有限公司,深圳威迈斯新能源（集团）股份有限公司,,False,False,False,False,high_risk_manual_review,p1,manual_review
深圳市赢时胜信息技术股份有限公司,10,深圳市赢时胜信息技术股份有限公司,深圳市赢时胜信息技术股份有限公司,,False,False,False,False,high_risk_manual_review,p1,manual_review
深圳智岩科技股份有限公司,10,深圳智岩科技股份有限公司,深圳智岩科技股份有限公司,,False,False,False,False,high_risk_manual_review,p1,manual_review
深圳精智达技术股份有限公司,10,深圳精智达技术股份有限公司,深圳精智达技术股份有限公司,,False,False,False,False,high_risk_manual_review,p1,manual_review
湖南快乐阳光互动娱乐传媒有限公司,10,湖南快乐阳光互动娱乐传媒有限公司,湖南快乐阳光互动娱乐传媒有限公司,,False,False,False,False,high_risk_manual_review,p1,manual_review
爱尔康（中国）眼科产品有限公司,10,爱尔康（中国）眼科产品有限公司,爱尔康（中国）眼科产品有限公司,,False,False,False,False,high_risk_manual_review,p1,manual_review
索尼（中国）有限公司,10,索尼（中国）有限公司,索尼（中国）有限公司,索尼,True,True,True,False,alias_to_existing_spring_parent,p1,add_alias_mapping
航天恒星科技有限公司,10,航天恒星科技有限公司,航天恒星科技有限公司,航天恒星,True,True,True,False,alias_to_existing_spring_parent,p1,add_alias_mapping
荣顺达科技集团有限公司,10,荣顺达科技集团有限公司,荣顺达科技集团有限公司,,False,False,False,False,high_risk_manual_review,p1,manual_review
藏格矿业股份有限公司,10,藏格矿业股份有限公司,藏格矿业股份有限公司,藏格矿业集团,True,True,True,False,alias_to_existing_spring_parent,p1,add_alias_mapping
通号城市轨道交通技术有限公司,10,通号城市轨道交通技术有限公司,通号城市轨道交通技术有限公司,,False,False,False,False,high_risk_manual_review,p1,manual_review
银华基金管理股份有限公司,10,银华基金管理股份有限公司,银华基金管理股份有限公司,,False,False,False,False,high_risk_manual_review,p1,manual_review
青矩技术股份有限公司,10,青矩技术股份有限公司,青矩技术股份有限公司,,False,False,False,False,high_risk_manual_review,p1,manual_review
高知特信息技术（上海）有限公司,10,高知特信息技术（上海）有限公司,高知特信息技术（上海）有限公司,高知特资讯技术,True,True,True,False,alias_to_existing_spring_parent,p1,add_alias_mapping
Blue Origin,9,BlueOrigin,BlueOrigin,,False,False,False,False,high_risk_manual_review,p1,manual_review
上海南芯半导体科技股份有限公司,9,上海南芯半导体科技股份有限公司,上海南芯半导体科技股份有限公司,,False,False,False,False,high_risk_manual_review,p1,manual_review
上海国际港务（集团）股份有限公司,9,上海国际港务（集团）股份有限公司,上海国际港务（集团）股份有限公司,,False,False,False,False,high_risk_manual_review,p1,manual_review
上海均瑶（集团）有限公司,9,上海均瑶（集团）有限公司,上海均瑶（集团）有限公司,,False,False,False,False,high_risk_manual_review,p1,manual_review
上海夺畅网络技术有限公司,9,上海夺畅网络技术有限公司,上海夺畅网络技术有限公司,,False,False,False,False,high_risk_manual_review,p1,manual_review
上海姜根酒店管理有限公司,9,上海姜根酒店管理有限公司,上海姜根酒店管理有限公司,,False,False,False,False,high_risk_manual_review,p1,manual_review
上海纽酷信息科技有限公司,9,上海纽酷信息科技有限公司,上海纽酷信息科技有限公司,,False,False,False,False,high_risk_manual_review,p1,manual_review
上海维信荟智金融科技有限公司,9,上海维信荟智金融科技有限公司,上海维信荟智金融科技有限公司,,False,False,False,False,high_risk_manual_review,p1,manual_review
上海非凸智能科技有限公司,9,上海非凸智能科技有限公司,上海非凸智能科技有限公司,,False,False,False,False,high_risk_manual_review,p1,manual_review
上海风语筑文化科技股份有限公司,9,上海风语筑文化科技股份有限公司,上海风语筑文化科技股份有限公司,,False,False,False,False,high_risk_manual_review,p1,manual_review
东兴证券股份有限公司,9,东兴证券股份有限公司,东兴证券股份有限公司,东兴证券,True,True,True,False,alias_to_existing_spring_parent,p1,add_alias_mapping
中化资本有限公司,9,中化资本有限公司,中化资本有限公司,,False,False,False,False,high_risk_manual_review,p1,manual_review
中国国际货运航空股份有限公司,9,中国国际货运航空股份有限公司,中国国际货运航空股份有限公司,,False,False,False,False,high_risk_manual_review,p1,manual_review
中国太平洋保险（集团）股份有限公司,9,中国太平洋保险（集团）股份有限公司,中国太平洋保险（集团）股份有限公司,,False,False,False,False,high_risk_manual_review,p1,manual_review
中国对外经济贸易信托有限公司,9,中国对外经济贸易信托有限公司,中国对外经济贸易信托有限公司,,False,False,False,False,high_risk_manual_review,p1,manual_review
中国建材集团有限公司,9,中国建材集团有限公司,中国建材集团有限公司,,False,False,False,False,high_risk_manual_review,p1,manual_review
中国轻工集团有限公司,9,中国轻工集团有限公司,中国轻工集团有限公司,,False,False,False,False,high_risk_manual_review,p1,manual_review
中国铁建电气化局集团有限公司,9,中国铁建电气化局集团有限公司,中国铁建电气化局集团有限公司,,False,False,False,False,high_risk_manual_review,p1,manual_review
中国银联股份有限公司,9,中国银联股份有限公司,中国银联股份有限公司,中国银联,True,True,True,False,alias_to_existing_spring_parent,p1,add_alias_mapping
中意人寿保险有限公司,9,中意人寿保险有限公司,中意人寿保险有限公司,中意人寿,True,True,True,False,alias_to_existing_spring_parent,p1,add_alias_mapping
乐元素科技（北京）股份有限公司,9,乐元素科技（北京）股份有限公司,乐元素科技（北京）股份有限公司,,False,False,False,False,high_risk_manual_review,p1,manual_review
乐普（北京）医疗器械股份有限公司,9,乐普（北京）医疗器械股份有限公司,乐普（北京）医疗器械股份有限公司,,False,False,False,False,high_risk_manual_review,p1,manual_review
九识（苏州）智能科技有限公司,9,九识（苏州）智能科技有限公司,九识（苏州）智能科技有限公司,,False,False,False,False,high_risk_manual_review,p1,manual_review
五八智能科技（杭州）有限公司,9,五八智能科技（杭州）有限公司,五八智能科技（杭州）有限公司,,False,False,False,False,high_risk_manual_review,p1,manual_review
佛山市人力资源和社会保障局,9,佛山市人力资源和社会保障局,佛山市人力资源和社会保障局,,False,False,False,False,high_risk_manual_review,p1,manual_review
北京中科闻歌科技股份有限公司,9,北京中科闻歌科技股份有限公司,北京中科闻歌科技股份有限公司,中科闻歌,True,True,True,False,alias_to_existing_spring_parent,p1,add_alias_mapping
北京智明星通科技股份有限公司,9,北京智明星通科技股份有限公司,北京智明星通科技股份有限公司,,False,False,False,False,high_risk_manual_review,p1,manual_review
北京金隅集团股份有限公司,9,北京金隅集团股份有限公司,北京金隅集团股份有限公司,,False,False,False,False,high_risk_manual_review,p1,manual_review
华望汽车技术（广州）有限公司,9,华望汽车技术（广州）有限公司,华望汽车技术（广州）有限公司,华望汽车,True,True,True,False,alias_to_existing_spring_parent,p1,add_alias_mapping
华林证券股份有限公司,9,华林证券股份有限公司,华林证券股份有限公司,,False,False,False,False,high_risk_manual_review,p1,manual_review
厦门国贸集团股份有限公司,9,厦门国贸集团股份有限公司,厦门国贸集团股份有限公司,,False,False,False,False,high_risk_manual_review,p1,manual_review
四川科伦药业股份有限公司,9,四川科伦药业股份有限公司,四川科伦药业股份有限公司,,False,False,False,False,high_risk_manual_review,p1,manual_review
国能日新科技股份有限公司,9,国能日新科技股份有限公司,国能日新科技股份有限公司,,False,False,False,False,high_risk_manual_review,p1,manual_review
多点生活（中国）网络科技有限公司,9,多点生活（中国）网络科技有限公司,多点生活（中国）网络科技有限公司,,False,False,False,False,high_risk_manual_review,p1,manual_review
太初（无锡）电子科技有限公司,9,太初（无锡）电子科技有限公司,太初（无锡）电子科技有限公司,,False,False,False,False,high_risk_manual_review,p1,manual_review
奇瑞控股集团有限公司,9,奇瑞控股集团有限公司,奇瑞控股集团有限公司,,False,False,False,False,high_risk_manual_review,p1,manual_review
广东高域科技有限公司,9,广东高域科技有限公司,广东高域科技有限公司,,False,False,False,False,high_risk_manual_review,p1,manual_review
广州开发区控股集团有限公司,9,广州开发区控股集团有限公司,广州开发区控股集团有限公司,,False,False,False,False,high_risk_manual_review,p1,manual_review
广州荔支网络技术有限公司,9,广州荔支网络技术有限公司,广州荔支网络技术有限公司,,False,False,False,False,high_risk_manual_review,p1,manual_review
成都育碧电脑软件有限公司,9,成都育碧电脑软件有限公司,成都育碧电脑软件有限公司,,False,False,False,False,high_risk_manual_review,p1,manual_review
拉尔夫劳伦贸易（上海）有限公司,9,拉尔夫劳伦贸易（上海）有限公司,拉尔夫劳伦贸易（上海）有限公司,,False,False,False,False,high_risk_manual_review,p1,manual_review
新兴际华集团有限公司,9,新兴际华集团有限公司,新兴际华集团有限公司,新兴际华集团,True,True,True,False,alias_to_existing_spring_parent,p1,add_alias_mapping
无问芯穹科技有限公司,9,无问芯穹科技有限公司,无问芯穹科技有限公司,,False,False,False,False,high_risk_manual_review,p1,manual_review
智平方（深圳）科技有限公司,9,智平方（深圳）科技有限公司,智平方（深圳）科技有限公司,,False,False,False,False,high_risk_manual_review,p1,manual_review
杭州嘉楠耘智信息科技有限公司,9,杭州嘉楠耘智信息科技有限公司,杭州嘉楠耘智信息科技有限公司,,False,False,False,False,high_risk_manual_review,p1,manual_review
杭州市余杭区海创人形机器人产业创新中心‌,9,杭州市余杭区海创人形机器人产业创新中心‌,杭州市余杭区海创人形机器人产业创新中心‌,,False,False,False,False,high_risk_manual_review,p1,manual_review
杭州老板电器股份有限公司,9,杭州老板电器股份有限公司,杭州老板电器股份有限公司,,False,False,False,False,high_risk_manual_review,p1,manual_review
深圳市中电电力技术股份有限公司,9,深圳市中电电力技术股份有限公司,深圳市中电电力技术股份有限公司,,False,False,False,False,high_risk_manual_review,p1,manual_review
深圳市优才人力资源有限公司,9,深圳市优才人力资源有限公司,深圳市优才人力资源有限公司,,False,False,False,False,high_risk_manual_review,p1,manual_review
深圳市创想三维科技股份有限公司,9,深圳市创想三维科技股份有限公司,深圳市创想三维科技股份有限公司,创想三维,True,True,True,False,alias_to_existing_spring_parent,p1,add_alias_mapping
深圳市宝能投资集团有限公司,9,深圳市宝能投资集团有限公司,深圳市宝能投资集团有限公司,,False,False,False,False,high_risk_manual_review,p1,manual_review
深圳市小赢科技有限责任公司,9,深圳市小赢科技有限责任公司,深圳市小赢科技有限责任公司,,False,False,False,False,high_risk_manual_review,p1,manual_review
深圳市思谋科技有限公司,9,深圳市思谋科技有限公司,深圳市思谋科技有限公司,,False,False,False,False,high_risk_manual_review,p1,manual_review
深圳市晨北科技有限公司,9,深圳市晨北科技有限公司,深圳市晨北科技有限公司,,False,False,False,False,high_risk_manual_review,p1,manual_review
深圳市玖治科技有限公司,9,深圳市玖治科技有限公司,深圳市玖治科技有限公司,,False,False,False,False,high_risk_manual_review,p1,manual_review
深圳市联软科技股份有限公司,9,深圳市联软科技股份有限公司,深圳市联软科技股份有限公司,,False,False,False,False,high_risk_manual_review,p1,manual_review
深圳心慧科技有限公司,9,深圳心慧科技有限公司,深圳心慧科技有限公司,,False,False,False,False,high_risk_manual_review,p1,manual_review
深圳能源集团股份有限公司,9,深圳能源集团股份有限公司,深圳能源集团股份有限公司,,False,False,False,False,high_risk_manual_review,p1,manual_review
深圳高芯思通科技有限公司,9,深圳高芯思通科技有限公司,深圳高芯思通科技有限公司,,False,False,False,False,high_risk_manual_review,p1,manual_review
碳一新能源集团有限责任公司,9,碳一新能源集团有限责任公司,碳一新能源集团有限责任公司,,False,False,False,False,high_risk_manual_review,p1,manual_review
福建纵腾网络有限公司,9,福建纵腾网络有限公司,福建纵腾网络有限公司,,False,False,False,False,high_risk_manual_review,p1,manual_review
联储证券股份有限公司,9,联储证券股份有限公司,联储证券股份有限公司,联储证券,True,True,True,False,alias_to_existing_spring_parent,p1,add_alias_mapping
联通支付有限公司,9,联通支付有限公司,联通支付有限公司,联通支付,True,True,True,False,alias_to_existing_spring_parent,p1,add_alias_mapping
菲利普莫里斯（中国）企业管理有限公司,9,菲利普莫里斯（中国）企业管理有限公司,菲利普莫里斯（中国）企业管理有限公司,,False,False,False,False,high_risk_manual_review,p1,manual_review
蓝月亮（中国）有限公司,9,蓝月亮（中国）有限公司,蓝月亮（中国）有限公司,蓝月亮,True,True,True,False,alias_to_existing_spring_parent,p1,add_alias_mapping
西井科技股份有限公司,9,西井科技股份有限公司,西井科技股份有限公司,,False,False,False,False,high_risk_manual_review,p1,manual_review
金开新能科技有限公司,9,金开新能科技有限公司,金开新能科技有限公司,,False,False,False,False,high_risk_manual_review,p1,manual_review
银联国际有限公司,9,银联国际有限公司,银联国际有限公司,银联国际,True,True,True,False,alias_to_existing_spring_parent,p1,add_alias_mapping
高新兴科技集团股份有限公司,9,高新兴科技集团股份有限公司,高新兴科技集团股份有限公司,,False,False,False,False,high_risk_manual_review,p1,manual_review
上海东方证券资产管理有限公司,8,上海东方证券资产管理有限公司,上海东方证券资产管理有限公司,,False,False,False,False,high_risk_manual_review,p1,manual_review
上海华测导航技术股份有限公司,8,上海华测导航技术股份有限公司,上海华测导航技术股份有限公司,华测导航,True,True,True,False,alias_to_existing_spring_parent,p1,add_alias_mapping
上海收钱吧互联网科技股份有限公司,8,上海收钱吧互联网科技股份有限公司,上海收钱吧互联网科技股份有限公司,收钱吧,True,True,True,False,alias_to_existing_spring_parent,p1,add_alias_mapping
世强先进（深圳）科技股份有限公司,8,世强先进（深圳）科技股份有限公司,世强先进（深圳）科技股份有限公司,,False,False,False,False,high_risk_manual_review,p1,manual_review
中再资产管理股份有限公司,8,中再资产管理股份有限公司,中再资产管理股份有限公司,,False,False,False,False,high_risk_manual_review,p1,manual_review
中国燃气控股有限公司,8,中国燃气控股有限公司,中国燃气控股有限公司,中国燃气,True,True,True,False,alias_to_existing_spring_parent,p1,add_alias_mapping
中国石油天然气集团有限公司,8,中国石油天然气集团有限公司,中国石油天然气集团有限公司,,False,False,False,False,high_risk_manual_review,p1,manual_review
中国联合网络通信有限公司深圳市分公司,8,中国联合网络通信有限公司深圳市分公司,中国联合网络通信有限公司,,False,False,False,False,high_risk_manual_review,p1,manual_review
中国联合网络通信有限公司软件研究院,8,中国联合网络通信有限公司软件研究院,中国联合网络通信有限公司软件研究院,,False,False,False,False,high_risk_manual_review,p1,manual_review
中国航天电子技术研究院,8,中国航天电子技术研究院,中国航天电子技术研究院,,False,False,False,False,high_risk_manual_review,p1,manual_review
中海企业发展集团有限公司,8,中海企业发展集团有限公司,中海企业发展集团有限公司,,False,False,False,False,high_risk_manual_review,p1,manual_review
中电科网络安全科技股份有限公司,8,中电科网络安全科技股份有限公司,中电科网络安全科技股份有限公司,,False,False,False,False,high_risk_manual_review,p1,manual_review
中科宇航技术股份有限公司,8,中科宇航技术股份有限公司,中科宇航技术股份有限公司,中科宇航,True,True,True,False,alias_to_existing_spring_parent,p1,add_alias_mapping
中邮消费金融有限公司,8,中邮消费金融有限公司,中邮消费金融有限公司,中邮消费金融,True,True,True,False,alias_to_existing_spring_parent,p1,add_alias_mapping
优三缔科技（上海）有限公司,8,优三缔科技（上海）有限公司,优三缔科技（上海）有限公司,,False,False,False,False,high_risk_manual_review,p1,manual_review
北京发那科机电有限公司,8,北京发那科机电有限公司,北京发那科机电有限公司,,False,False,False,False,high_risk_manual_review,p1,manual_review
北京弘历通投资顾问有限公司,8,北京弘历通投资顾问有限公司,北京弘历通投资顾问有限公司,,False,False,False,False,high_risk_manual_review,p1,manual_review
北京智芯微电子科技有限公司,8,北京智芯微电子科技有限公司,北京智芯微电子科技有限公司,,False,False,False,False,high_risk_manual_review,p1,manual_review
千寻智能（杭州）科技有限公司,8,千寻智能（杭州）科技有限公司,千寻智能（杭州）科技有限公司,,False,False,False,False,high_risk_manual_review,p1,manual_review
华安财产保险股份有限公司,8,华安财产保险股份有限公司,华安财产保险股份有限公司,,False,False,False,False,high_risk_manual_review,p1,manual_review
华海智汇技术有限公司,8,华海智汇技术有限公司,华海智汇技术有限公司,,False,False,False,False,high_risk_manual_review,p1,manual_review
华港财富集团有限公司,8,华港财富集团有限公司,华港财富集团有限公司,,False,False,False,False,high_risk_manual_review,p1,manual_review
南京银行股份有限公司,8,南京银行股份有限公司,南京银行股份有限公司,上海银行,True,True,True,False,alias_to_existing_spring_parent,p1,add_alias_mapping
厦门建发集团有限公司,8,厦门建发集团有限公司,厦门建发集团有限公司,,False,False,False,False,high_risk_manual_review,p1,manual_review
天翼物联科技有限公司,8,天翼物联科技有限公司,天翼物联科技有限公司,,False,False,False,False,high_risk_manual_review,p1,manual_review
天翼电子商务有限公司,8,天翼电子商务有限公司,天翼电子商务有限公司,,False,False,False,False,high_risk_manual_review,p1,manual_review
山东发展新能源有限公司,8,山东发展新能源有限公司,山东发展新能源有限公司,,False,False,False,False,high_risk_manual_review,p1,manual_review
广州中海达卫星导航技术股份有限公司,8,广州中海达卫星导航技术股份有限公司,广州中海达卫星导航技术股份有限公司,,False,False,False,False,high_risk_manual_review,p1,manual_review
广州灵感游戏科技有限公司,8,广州灵感游戏科技有限公司,广州灵感游戏科技有限公司,,False,False,False,False,high_risk_manual_review,p1,manual_review
广州环保投资集团有限公司,8,广州环保投资集团有限公司,广州环保投资集团有限公司,,False,False,False,False,high_risk_manual_review,p1,manual_review
康龙化成（北京）新药技术股份有限公司,8,康龙化成（北京）新药技术股份有限公司,康龙化成（北京）新药技术股份有限公司,,False,False,False,False,high_risk_manual_review,p1,manual_review
